{
  "schemaVersion": 1,
  "providerId": "anthropic-claude",
  "displayName": "Claude 官方",
  "credential": {
    "slot": "anthropic-claude",
    "developmentCredentialReference": "a7eb2fde-89f4-4f45-9f24-3e8d0719201e",
    "headerForm": "x-api-key",
    "anthropicVersion": "2023-06-01",
    "headerEvidence": "claude-platform-docs"
  },
  "evidence": {
    "claude-platform-docs": {
      "kind": "vendor-documentation",
      "source": "Claude Platform documentation, platform.claude.com (docs.claude.com redirects there) — Messages API, models overview",
      "readOn": "2026-09-10",
      "note": "Endpoint `https://api.anthropic.com/v1/messages`, `x-api-key` with `anthropic-version: 2023-06-01`; models `claude-opus-5`, `claude-fable-5-1`, `claude-sonnet-5` (1M context / 128K output) and `claude-haiku-4-5` (200K / 64K) (ADR 0080 §3)."
    },
    "claude-web-search-tool": {
      "kind": "vendor-documentation",
      "source": "Claude Platform documentation, web search tool, platform.claude.com",
      "readOn": "2026-09-10",
      "note": "A server-side tool executed on Anthropic's infrastructure: `web_search_20250305`, `web_search_20260209`, `web_search_20260318`, $10 per 1,000 searches; the page names no per-model support list and no model restriction, so the tool is read as route-wide, every model on the route (ADR 0080 §3)."
    },
    "claude-text-answer-docs": {
      "kind": "vendor-documentation",
      "source": "https://platform.claude.com/docs/en/about-claude/models/overview ; https://platform.claude.com/docs/en/models/opus-5/overview ; https://platform.claude.com/docs/en/models/sonnet-5/overview ; https://platform.claude.com/docs/en/models/haiku-4-5/overview ; https://platform.claude.com/docs/en/build-with-claude/working-with-messages",
      "readOn": "2026-10-31",
      "note": "The overview says all current models (Claude Fable 5.1 among them, `claude-fable-5-1`) support text output; the Claude Opus 5 (`claude-opus-5`), Claude Sonnet 5 (`claude-sonnet-5`) and Claude Haiku 4.5 (alias `claude-haiku-4-5` of `claude-haiku-4-5-20251001`) pages each state Input → output `Text and images → text`. The Messages guide lists all four as supported models and shows the answer as `content: [{\"type\": \"text\", \"text\": ...}]` with `usage.input_tokens`/`output_tokens`. No page read says whether `output_tokens` includes thinking, so usage attribution stays undeclared. Claude Opus 5, Sonnet 5 and Haiku 4.5 are marked legacy; the Haiku 4.5 page states retirement not sooner than 2026-10-15 and status Active (legacy). Documentation is not per-account availability or live proof."
    },
    "unverified": { "kind": "unverified" }
  },
  "routes": [
    {
      "routeId": "anthropic-claude",
      "displayName": "Claude 官方 · Messages",
      "endpoint": "https://api.anthropic.com/v1/messages",
      "requestShape": "anthropic-messages",
      "requestShapeEvidence": "claude-platform-docs",
      "limitPolicy": "rate-limit-retryable",
      "limitPolicyEvidence": "unverified",
      "dshAttribution": false,
      "dshAttributionEvidence": "unverified",
      "sessionHeader": false,
      "sessionHeaderEvidence": "unverified",
      "maxOutputTokens": 32768,
      "routeCapabilities": {
        "webSearchTool": { "value": "provider-tool", "evidence": "claude-web-search-tool" }
      },
      "note": "The shape requires a per-turn output cap; the route declares the same 32,768 as the OpenCode Go `/messages` route for the same reason — headroom above the largest unit output observed (24,225 tokens), one turn only — and below every listed model's output limit.",
      "models": [
        { "modelId": "claude-opus-5", "displayName": "Claude Opus 5", "capabilities": { "answerChannel": { "value": "content-text-blocks", "evidence": "claude-text-answer-docs" } }, "context": { "tokens": 1000000, "evidence": "claude-platform-docs" } },
        { "modelId": "claude-fable-5-1", "displayName": "Claude Fable 5.1", "capabilities": { "answerChannel": { "value": "content-text-blocks", "evidence": "claude-text-answer-docs" } }, "context": { "tokens": 1000000, "evidence": "claude-platform-docs" } },
        { "modelId": "claude-sonnet-5", "displayName": "Claude Sonnet 5", "capabilities": { "answerChannel": { "value": "content-text-blocks", "evidence": "claude-text-answer-docs" } }, "context": { "tokens": 1000000, "evidence": "claude-platform-docs" } },
        { "modelId": "claude-haiku-4-5", "displayName": "Claude Haiku 4.5", "capabilities": { "answerChannel": { "value": "content-text-blocks", "evidence": "claude-text-answer-docs" } }, "context": { "tokens": 200000, "evidence": "claude-platform-docs" } }
      ]
    }
  ],
  "openQuestions": [
    "The limit reading is not established: no page read states the shape of this endpoint's rate-limit or account-limit response, so a 429 is read as a retryable rate limit (`rate-limit-retryable`, `unverified`) until a page or a named live item says otherwise.",
    "The Claude 5 family rejects `thinking.type: \"enabled\"` and takes `thinking: {type: \"adaptive\"}` with `output_config.effort`; structured outputs are GA through `output_config.format`. Neither spelling is implemented by the adapter, so both stay absent until a slice implements and a live item establishes them."
  ]
}
