{
  "schemaVersion": 1,
  "providerId": "openai-platform",
  "displayName": "OpenAI 官方",
  "credential": {
    "slot": "openai-platform",
    "developmentCredentialReference": "c8c4e0f8-27dd-45ad-8c60-580a5d58b799",
    "headerForm": "authorization-bearer",
    "anthropicVersion": null,
    "headerEvidence": "openai-api-docs"
  },
  "evidence": {
    "openai-api-docs": {
      "kind": "vendor-documentation",
      "source": "https://developers.openai.com/api/docs/models/gpt-5.6-sol ; https://developers.openai.com/api/docs/models/gpt-5.6-luna ; https://developers.openai.com/api/reference/overview ; https://developers.openai.com/api/reference/resources/responses/methods/create",
      "readOn": "2026-10-22",
      "note": "Official docs confirm exact gpt-5.6-sol and gpt-5.6-luna text input/output, 1,050,000 context, 128,000 maximum output, POST https://api.openai.com/v1/responses and Authorization: Bearer. Responses output message output_text and input_tokens/output_tokens with reasoning token details. Documentation is not per-account availability or live proof. This build admits buffered text only; tools, native streaming, structured output and reasoning control remain absent."
    },
    "openai-web-search-tool": {
      "kind": "vendor-documentation",
      "source": "OpenAI API documentation, web search tool guide and models page, developers.openai.com/api/docs",
      "readOn": "2026-09-10",
      "note": "Server-side in the Responses API — `\"tools\": [{\"type\": \"web_search\"}]` — with `url_citation` annotations and a `sources` list; the models page lists Web search in every flagship's tools row (ADR 0080 §3)."
    },
    "unverified": {
      "kind": "unverified"
    }
  },
  "routes": [
    {
      "routeId": "openai-platform",
      "displayName": "OpenAI 官方 · Responses",
      "endpoint": "https://api.openai.com/v1/responses",
      "requestShape": "openai-responses",
      "requestShapeEvidence": "openai-api-docs",
      "limitPolicy": "rate-limit-retryable",
      "limitPolicyEvidence": "unverified",
      "dshAttribution": false,
      "dshAttributionEvidence": "unverified",
      "sessionHeader": false,
      "sessionHeaderEvidence": "unverified",
      "maxOutputTokens": 8192,
      "routeCapabilities": {
        "webSearchTool": {
          "value": "provider-tool",
          "evidence": "openai-web-search-tool"
        }
      },
      "note": "Buffered text only with max_output_tokens 8192. The explicit synthetic connection test narrows this to 512; neither probe nor saved credential proves tools or native streaming.",
      "models": [
        {
          "modelId": "gpt-6-astra",
          "displayName": "GPT-6 Astra",
          "context": {
            "tokens": 1050000,
            "evidence": "openai-api-docs"
          }
        },
        {
          "modelId": "gpt-5.6-sol",
          "displayName": "GPT-5.6 Sol",
          "context": {
            "tokens": 1050000,
            "evidence": "openai-api-docs"
          },
          "capabilities": {
            "answerChannel": {
              "value": "output-message-text",
              "evidence": "openai-api-docs"
            },
            "usageAttribution": {
              "value": "includes-reasoning",
              "evidence": "openai-api-docs"
            }
          }
        },
        {
          "modelId": "gpt-5.6-terra",
          "displayName": "GPT-5.6 Terra",
          "context": {
            "tokens": 1050000,
            "evidence": "openai-api-docs"
          }
        },
        {
          "modelId": "gpt-5.6-luna",
          "displayName": "GPT-5.6 Luna",
          "context": {
            "tokens": 1050000,
            "evidence": "openai-api-docs"
          },
          "capabilities": {
            "answerChannel": {
              "value": "output-message-text",
              "evidence": "openai-api-docs"
            },
            "usageAttribution": {
              "value": "includes-reasoning",
              "evidence": "openai-api-docs"
            }
          }
        }
      ]
    }
  ],
  "openQuestions": [
    "Account/model access requires the editor-initiated exact-binding text test; no live access was tested by Issue #1044.",
    "Function tools, opaque reasoning replay, structured outputs, reasoning control and native streaming remain unadmitted.",
    "429/account denial is classified by the existing adapter; AI7 does not automatically retry or choose another binding."
  ]
}
